{
  "$schema": "https://json-schema.org/draft/2020-12/schema",
  "$id": "https://github.com/Super-Protocol/confidential-router/schemas/rego-input.schema.json",
  "title": "Gatekeeper Rego input document",
  "description": "The `input` the gatekeeper evaluates every policy package against, built only after the evidence bundle passed cryptographic verification. See docs/contracts/rego-input.md.",
  "type": "object",
  "additionalProperties": false,
  "required": ["endpoint", "upstream", "attestation", "evidence"],
  "properties": {
    "endpoint": {
      "type": "string",
      "pattern": "^[a-z0-9][a-z0-9-]{0,62}$",
      "description": "endpoints[].name from the gatekeeper config."
    },
    "upstream": {
      "type": "object",
      "additionalProperties": false,
      "required": ["hostname", "port"],
      "properties": {
        "hostname": { "type": "string", "minLength": 1 },
        "port": { "type": "integer", "minimum": 1, "maximum": 65535 }
      }
    },
    "attestation": {
      "type": "object",
      "additionalProperties": false,
      "required": [
        "verified",
        "channelBinding",
        "root",
        "rootFingerprint",
        "observedTlsFingerprint",
        "verifiedAt"
      ],
      "properties": {
        "verified": {
          "const": true,
          "description": "Always true: Rego never runs on unverified evidence."
        },
        "channelBinding": {
          "const": "observed",
          "description": "The gatekeeper always binds to the live TLS leaf it observed."
        },
        "root": {
          "type": "string",
          "description": "Name of the root the chain terminated in: a trustedRoots[].name, or `attested:<mrEnclave>` for a root accepted on its own TEE evidence (see rootAttestation)."
        },
        "rootFingerprint": { "$ref": "#/$defs/fingerprint" },
        "observedTlsFingerprint": { "$ref": "#/$defs/fingerprint" },
        "verifiedAt": { "type": "string", "format": "date-time" },
        "quoteFormat": {
          "type": "string",
          "enum": ["intel-tdx-quote-v5", "amd-sev-snp-report"],
          "description": "bundle.rootCaTeeQuote.format when present (displayed, not validated)."
        },
        "rootAttestation": {
          "description": "Present only when the chain's terminal root was checked against its own TEE evidence, which happens when the manual trustedRoots list did not match it. Absent for a root the user pinned, so a policy can require one or the other.",
          "type": "object",
          "additionalProperties": false,
          "required": [
            "attested",
            "inRegistry",
            "reportIntegrity",
            "keyBinding",
            "teeFlags"
          ],
          "properties": {
            "attested": {
              "type": "boolean",
              "description": "Whether the root was accepted on its evidence. False here means the verdict came from somewhere else, or was a denial."
            },
            "evidenceType": {
              "type": "string",
              "description": "Hardware the certificate authority enrolled from, e.g. \"AMD SEV-SNP (QEMU)\"."
            },
            "networkType": {
              "type": "string",
              "enum": ["trusted", "untrusted"],
              "description": "The network the root certificate declares. Reported, not enforced, unless attestedRoots.requireNetworkType says otherwise."
            },
            "measurement": {
              "type": "string",
              "pattern": "^[0-9a-f]{64}$",
              "description": "Normalised mrEnclave of the certificate authority's VM, in hex."
            },
            "inRegistry": {
              "type": "boolean",
              "description": "Whether Super Protocol has signed that measurement."
            },
            "measurementSource": {
              "type": "string",
              "enum": ["registry", "operator-pinned", ""],
              "description": "Which anchor admitted the measurement: \"registry\" when Super Protocol signed it, \"operator-pinned\" when the operator listed it in attestedRoots.trustedMeasurements because the registry does not. Empty when nothing vouched for it, which is a denial. A measurement the registry does sign is always reported as \"registry\", whether or not it is also pinned, so a rule keyed on this cannot be relaxed by adding a redundant pin."
            },
            "reportIntegrity": {
              "type": "boolean",
              "description": "Whether the hardware report's signature and its chain to the CPU vendor's root verified."
            },
            "revocationChecked": {
              "type": "boolean",
              "description": "Whether the vendor CRLs were consulted. False means they were not, never that the chain is clean."
            },
            "notRevoked": {
              "type": "boolean",
              "description": "Result of that check, meaningful only when revocationChecked is true."
            },
            "keyBinding": {
              "type": "boolean",
              "description": "Whether the report's reportData commits to this certificate's public key."
            },
            "cpuGeneration": {
              "type": "string",
              "description": "CPU line the verified vendor chain belongs to, e.g. \"Genoa\"."
            },
            "teeFlags": {
              "description": "Report fields describing how the VM was allowed to run. Reported as read: which combination is acceptable is what this policy is for.",
              "type": "object",
              "additionalProperties": false,
              "properties": {
                "vmpl": { "type": "number" },
                "debugAllowed": { "type": "boolean" },
                "ciphertextHiding": { "type": "boolean" },
                "pageSwapDisabled": { "type": "boolean" },
                "snpFirmwareTcb": { "type": "number" },
                "reportVersion": { "type": "number" }
              }
            }
          }
        }
      }
    },
    "evidence": {
      "description": "The verified DeploymentEvidence JWS payload plus convenience fields. Unknown payload fields are passed through.",
      "type": "object",
      "required": [
        "version",
        "kind",
        "hostname",
        "issuedAt",
        "certFingerprint",
        "evidenceDigest",
        "containerImages",
        "evidenceDigestHex",
        "certFingerprintHex"
      ],
      "properties": {
        "version": { "const": "1" },
        "kind": { "const": "DeploymentEvidence" },
        "hostname": { "type": "string", "minLength": 1 },
        "issuedAt": { "type": "string", "format": "date-time" },
        "certFingerprint": { "$ref": "#/$defs/fingerprint" },
        "evidenceDigest": {
          "$ref": "#/$defs/fingerprint",
          "description": "Normalised to canonical sha256/<base64url> before evaluation."
        },
        "evidence": {
          "type": "object",
          "description": "Canonical deployment snapshot as published (opaque; version 2 = { version, resources[] })."
        },
        "containerImages": {
          "type": "array",
          "uniqueItems": true,
          "items": { "type": "string", "minLength": 1 },
          "description": "Every string `image` field found in the snapshot, flattened and deduplicated."
        },
        "evidenceDigestHex": { "$ref": "#/$defs/hex256" },
        "certFingerprintHex": { "$ref": "#/$defs/hex256" }
      }
    }
  },
  "$defs": {
    "fingerprint": {
      "type": "string",
      "pattern": "^sha256/[A-Za-z0-9_-]{43}$",
      "description": "sha256/<base64url, unpadded> of DER bytes or of the canonical JSON."
    },
    "hex256": { "type": "string", "pattern": "^[0-9a-f]{64}$" }
  }
}
